,created_at,tweet_id,api_source,favorite_count,retweet_count,full_text,source_name
1111,2016-05-19,733109485275860992,"<a href=""http://twitter.com/download/iphone"" rel=""nofollow"">Twitter for iPhone</a>",44619,17621,"Like father (doggo), like son (pupper). Both 12/10 https://t.co/pG2inLaOda",Twitter for iPhone
1112,2016-05-18,732732193018155009,"<a href=""http://twitter.com/download/iphone"" rel=""nofollow"">Twitter for iPhone</a>",2671,599,This is Ralpher. He's an East Guinean Flop Dog. Cuddly af. 12/10 https://t.co/rVOLuNRpjH,Twitter for iPhone
1113,2016-05-18,732726085725589504,"<a href=""http://twitter.com/download/iphone"" rel=""nofollow"">Twitter for iPhone</a>",3855,1003,This is Aldrick. He looks wise af. Also exceptionally fluffy. Only two legs tho (unfortunate). 11/10 would still hug https://t.co/QwiCVLPMNL,Twitter for iPhone
1114,2016-05-17,732585889486888962,"<a href=""http://twitter.com/download/iphone"" rel=""nofollow"">Twitter for iPhone</a>",4016,868,"When your teacher agreed on 10,000 RTs and no final but after 24 hours you only have 37... 10/10 https://t.co/sVnJfWVjUp",Twitter for iPhone
1115,2016-05-17,732375214819057664,"<a href=""http://twitter.com/download/iphone"" rel=""nofollow"">Twitter for iPhone</a>",8832,2838,This is Kyle (pronounced 'Mitch'). He strives to be the best doggo he can be. 11/10 would pat on head approvingly https://t.co/aA2GiTGvlE,Twitter for iPhone
1116,2016-05-16,732005617171337216,"<a href=""http://twitter.com/download/iphone"" rel=""nofollow"">Twitter for iPhone</a>",16324,6154,This is Larry. He has no self control. Tongue still nifty af tho 11/10 https://t.co/ghyT4Ubk1r,Twitter for iPhone
1117,2016-05-14,731285275100512256,"<a href=""http://twitter.com/download/iphone"" rel=""nofollow"">Twitter for iPhone</a>",3798,1090,This is Solomon. He's a Beneroo Cumberflop. 12/10 would hug passionately https://t.co/5phLAnGPTP,Twitter for iPhone
1118,2016-05-13,731156023742988288,"<a href=""http://twitter.com/download/iphone"" rel=""nofollow"">Twitter for iPhone</a>",4196,1434,Say hello to this unbelievably well behaved squad of doggos. 204/170 would try to pet all at once https://t.co/yGQI3He3xv,Twitter for iPhone
1119,2016-05-13,730924654643314689,"<a href=""http://twitter.com/download/iphone"" rel=""nofollow"">Twitter for iPhone</a>",6682,2234,We only rate dogs. Pls stop sending non-canines like this Bulgarian Eyeless Porch Bear. This is unacceptable... 9/10 https://t.co/2yctWAUZ3Z,Twitter for iPhone
1120,2016-05-12,730573383004487680,"<a href=""http://twitter.com/download/iphone"" rel=""nofollow"">Twitter for iPhone</a>",5407,2435,This is Rooney. He can't comprehend glass. 10/10 it'll be ok pupper https://t.co/CnUl2uDBBV,Twitter for iPhone
1121,2016-05-11,730427201120833536,"<a href=""http://twitter.com/download/iphone"" rel=""nofollow"">Twitter for iPhone</a>",3809,1176,This is Crystal. She's flawless. Really wants to be a frat bro. 11/10 who does she even know here? https://t.co/WyqNFvEulG,Twitter for iPhone
1122,2016-05-11,730211855403241472,"<a href=""http://twitter.com/download/iphone"" rel=""nofollow"">Twitter for iPhone</a>",4180,1182,This is Ziva. She doesn't know how her collar works. 11/10 would totally fix for her https://t.co/K7pthJXjWE,Twitter for iPhone
1123,2016-05-11,730196704625098752,"<a href=""http://twitter.com/download/iphone"" rel=""nofollow"">Twitter for iPhone</a>",5339,2172,This is Charles. He's camera shy. Tail longer than average. Doesn't look overwhelmingly fluffy. 6/10 would still pet https://t.co/rXvcElhoog,Twitter for iPhone
1124,2016-05-10,729854734790754305,"<a href=""http://twitter.com/download/iphone"" rel=""nofollow"">Twitter for iPhone</a>",4396,1268,Say hello to Ollie. He conducts this train. He also greets you as you enter. Kind af. 11/10 would pet so firmly https://t.co/jVxOGKEU0z,Twitter for iPhone
1125,2016-05-10,729838605770891264,"<a href=""http://twitter.com/download/iphone"" rel=""nofollow"">Twitter for iPhone</a>",1856,431,"""Challenge completed"" 
(pupgraded to 12/10) https://t.co/85dTK7XCXB",Twitter for iPhone
1126,2016-05-10,729823566028484608,"<a href=""http://twitter.com/download/iphone"" rel=""nofollow"">Twitter for iPhone</a>",4358,1390,This is Stefan. He's a downright remarkable pup. 13/10 https://t.co/Ebjt6Y4fMh,Twitter for iPhone
1127,2016-05-09,729463711119904772,"<a href=""http://twitter.com/download/iphone"" rel=""nofollow"">Twitter for iPhone</a>",6340,2586,Meet Pupcasso. You can't afford his art. 13/10 talented af https://t.co/f2VUpy4WO0,Twitter for iPhone
1128,2016-05-08,729113531270991872,"<a href=""http://twitter.com/download/iphone"" rel=""nofollow"">Twitter for iPhone</a>",2054,370,"""Challenge accepted""
10/10 https://t.co/vNjvr5Bl9u",Twitter for iPhone
1129,2016-05-07,728986383096946689,"<a href=""http://twitter.com/download/iphone"" rel=""nofollow"">Twitter for iPhone</a>",3460,917,"This is Puff. He started out on the streets (first pic), but don't let the new smile fool you, still tough af. 11/10 https://t.co/kiuXRXcg4B",Twitter for iPhone
1130,2016-05-07,728760639972315136,"<a href=""http://twitter.com/download/iphone"" rel=""nofollow"">Twitter for iPhone</a>",5090,1911,"When you're way too slow for the ""down low"" portion of a high five. 13/10 https://t.co/Cofwoy7Vpq",Twitter for iPhone
1131,2016-05-07,728751179681943552,"<a href=""http://twitter.com/download/iphone"" rel=""nofollow"">Twitter for iPhone</a>",3032,757,This is Flurpson. He can't believe it's not butter. 10/10 https://t.co/XD3ort1PsE,Twitter for iPhone
1132,2016-05-06,728653952833728512,"<a href=""http://twitter.com/download/iphone"" rel=""nofollow"">Twitter for iPhone</a>",3620,1169,This is Coleman. Somebody needs to tell him that he's sitting in chairs wrong. 8/10 https://t.co/O10zjJ2Ixs,Twitter for iPhone
1133,2016-05-06,728409960103686147,"<a href=""http://twitter.com/download/iphone"" rel=""nofollow"">Twitter for iPhone</a>",5383,2269,This is Wallace. He's a skater pup. He said see ya later pup. Can easily do a kick flip. Gnarly af. 10/10 v petable https://t.co/5i8fORVKgr,Twitter for iPhone
1134,2016-05-06,728387165835677696,"<a href=""http://twitter.com/download/iphone"" rel=""nofollow"">Twitter for iPhone</a>",3999,1075,"This is Enchilada (yes, that's her real name). She's a Low-Cruisin Plopflopple. Very rare. Only a few left. 12/10 https://t.co/SiaiTWgsfP",Twitter for iPhone
1135,2016-05-05,728046963732717569,"<a href=""http://twitter.com/download/iphone"" rel=""nofollow"">Twitter for iPhone</a>",4722,1328,This is Raymond. He controls fountains with his tongue. 11/10 pretty damn magical https://t.co/9aMxSbOaAZ,Twitter for iPhone
1136,2016-05-05,728035342121635841,"<a href=""http://twitter.com/download/iphone"" rel=""nofollow"">Twitter for iPhone</a>",4953,1872,This is all I want in my life. 12/10 for super sleepy pupper https://t.co/4RlLA5ObMh,Twitter for iPhone
1137,2016-05-05,728015554473250816,"<a href=""http://twitter.com/download/iphone"" rel=""nofollow"">Twitter for iPhone</a>",4479,1219,This is Rueben. He has reached ultimate pupper zen state. 11/10 tranquil af https://t.co/Z167HgtnBi,Twitter for iPhone
1138,2016-05-04,727685679342333952,"<a href=""http://twitter.com/download/iphone"" rel=""nofollow"">Twitter for iPhone</a>",3206,720,This is Cilantro. She's a Fellation Gadzooks. Eyes are super magical af. 12/10 could get lost in https://t.co/yJ26LNuyj5,Twitter for iPhone
1139,2016-05-03,727644517743104000,"<a href=""http://twitter.com/download/iphone"" rel=""nofollow"">Twitter for iPhone</a>",6431,1962,Here's a doggo struggling to cope with the winds. 13/10 https://t.co/qv3aUwaouT,Twitter for iPhone
1140,2016-05-03,727524757080539137,"<a href=""http://twitter.com/download/iphone"" rel=""nofollow"">Twitter for iPhone</a>",4900,1379,This pupper had to undergo emergency haircut surgery so he could hear again. 10/10 miraculous af https://t.co/fUyDIFkBwx,Twitter for iPhone
1141,2016-05-03,727314416056803329,"<a href=""http://twitter.com/download/iphone"" rel=""nofollow"">Twitter for iPhone</a>",3623,834,This pupper was about to explain where that dirt came from but then decided against it. 11/10 https://t.co/SbaelU6zRs,Twitter for iPhone
1142,2016-05-02,727286334147182592,"<a href=""http://twitter.com/download/iphone"" rel=""nofollow"">Twitter for iPhone</a>",3324,920,I swear to god if we get sent another Blue Madagascan Peacock we'll deactivate. We ðŸ‘ Only ðŸ‘ Rate ðŸ‘ Dogs... 9/10 https://t.co/bbta2Q4URK,Twitter for iPhone
1143,2016-05-02,727175381690781696,"<a href=""http://twitter.com/download/iphone"" rel=""nofollow"">Twitter for iPhone</a>",4209,1540,This is Karll. He just wants to go kayaking. 10/10 please someone take Karll kayaking already https://t.co/vXLkvyNQHp,Twitter for iPhone
1144,2016-05-02,727155742655025152,"<a href=""http://vine.co"" rel=""nofollow"">Vine - Make a Scene</a>",3983,1490,When you're trying to enjoy yourself but end up having to take care of your way too drunk friend. 11/10 https://t.co/BRkhj6tdN0,Vine - Make a Scene
1145,2016-05-02,726935089318363137,"<a href=""http://twitter.com/download/iphone"" rel=""nofollow"">Twitter for iPhone</a>",7496,2738,This is Sprout. He's just precious af. 12/10 I'd do anything for Sprout https://t.co/DxlX1yTVYY,Twitter for iPhone
1146,2016-05-01,726887082820554753,"<a href=""http://twitter.com/download/iphone"" rel=""nofollow"">Twitter for iPhone</a>",4195,1677,This is Blitz. He's a new dad struggling to cope mentally with the pressures of being a father. Sick shades 10/10 https://t.co/2AVcJ2BZsy,Twitter for iPhone
1147,2016-05-01,726828223124897792,"<a href=""http://twitter.com/download/iphone"" rel=""nofollow"">Twitter for iPhone</a>",3882,1124,This is Bloop. He's a Phoenician Winnebago. Tongue is just wow. That box is all he has (tragic). 12/10 would caress https://t.co/DWNrPPXgHA,Twitter for iPhone
1148,2016-04-30,726224900189511680,"<a href=""http://twitter.com/download/iphone"" rel=""nofollow"">Twitter for iPhone</a>",4811,1302,I'm getting super heckin frustrated with you all sending in non canines like this ostrich. We only rate dogs... 9/10 https://t.co/Rgbni2Ns8z,Twitter for iPhone
1149,2016-04-29,725842289046749185,"<a href=""http://twitter.com/download/iphone"" rel=""nofollow"">Twitter for iPhone</a>",7691,2970,This is Colby. He's currently regretting all those times he shook your hand for an extra treat. 12/10 https://t.co/vtVHtKFtBH,Twitter for iPhone
1150,2016-04-28,725786712245440512,"<a href=""http://twitter.com/download/iphone"" rel=""nofollow"">Twitter for iPhone</a>",4537,1527,Say hello to Lillie. She's a Rutabagan Floofem. Poor pupper ate and then passed out. 11/10 relatable af https://t.co/uIdGqug9rw,Twitter for iPhone
1151,2016-04-28,725729321944506368,"<a href=""http://twitter.com/download/iphone"" rel=""nofollow"">Twitter for iPhone</a>",5646,2009,This is Lola. She's a Butternut Splishnsplash. They are known to be ferocious af. 12/10 would absolutely still pet https://t.co/adQt5a6TZU,Twitter for iPhone
1152,2016-04-27,725458796924002305,"<a href=""http://twitter.com/download/iphone"" rel=""nofollow"">Twitter for iPhone</a>",1541,703,"Pup had to be removed cuz it wouldn't have been fair to the opposing team. 13/10 absolute legend âš½ï¸
https://t.co/BHICimO58W",Twitter for iPhone
1153,2016-04-26,724983749226668032,"<a href=""http://twitter.com/download/iphone"" rel=""nofollow"">Twitter for iPhone</a>",4040,1462,This is Fred-Rick. He dabbles in parkour. The elevation gives him power. 12/10 hopefully visiting a mailbox near you https://t.co/qFqLtudIiD,Twitter for iPhone
1154,2016-04-26,724771698126512129,"<a href=""http://twitter.com/download/iphone"" rel=""nofollow"">Twitter for iPhone</a>",2593,725,Nothin better than a doggo and a sunset. 11/10 https://t.co/JlFqOhrHEs,Twitter for iPhone
1155,2016-04-25,724405726123311104,"<a href=""http://twitter.com/download/iphone"" rel=""nofollow"">Twitter for iPhone</a>",5800,1847,This is Ashleigh. She's having Coachella withdrawals. Didn't even go tho. 10/10 stay strong pupper https://t.co/nRUaKWnJfH,Twitter for iPhone
1156,2016-04-24,724049859469295616,"<a href=""http://twitter.com/download/iphone"" rel=""nofollow"">Twitter for iPhone</a>",4738,1984,This is Kreggory. He just took a look at his student debt. 10/10 can't even comprehend it https://t.co/XTsZTgilnT,Twitter for iPhone
1157,2016-04-24,724046343203856385,"<a href=""http://twitter.com/download/iphone"" rel=""nofollow"">Twitter for iPhone</a>",2901,620,"This is Sarge. Not even he knows what his tongue is doing, but it's pretty damn spectacular. 10/10 https://t.co/pIQEdbBxdL",Twitter for iPhone
1158,2016-04-23,724004602748780546,"<a href=""http://twitter.com/download/iphone"" rel=""nofollow"">Twitter for iPhone</a>",4561,1790,This is Luther. He saw a ghost. Spooked af. 11/10 hang in there pupper https://t.co/EdKG43VvEl,Twitter for iPhone
1159,2016-04-23,723912936180330496,"<a href=""http://twitter.com/download/iphone"" rel=""nofollow"">Twitter for iPhone</a>",4236,1374,This is Sugar. She's a Bolivian Superfloof. Spherical af. 12/10 would never let go of https://t.co/AhMfUu6Onm,Twitter for iPhone
1160,2016-04-23,723688335806480385,"<a href=""http://twitter.com/download/iphone"" rel=""nofollow"">Twitter for iPhone</a>",8435,3347,This is Reginald. He starts screaming at random. 12/10 cuddly af https://t.co/YgNuDQbv89,Twitter for iPhone
1161,2016-04-23,723673163800948736,"<a href=""http://twitter.com/download/iphone"" rel=""nofollow"">Twitter for iPhone</a>",3291,1011,This is Ivar. She is a badass Viking warrior. Will sack your village. 10/10 savage af https://t.co/Dz6MiVssVU,Twitter for iPhone
1162,2016-04-21,723179728551723008,"<a href=""http://twitter.com/download/iphone"" rel=""nofollow"">Twitter for iPhone</a>",5761,2110,This is Jangle. She's addicted to broccoli. It's the only thing she cares about. Tragic af. 8/10 get help pup https://t.co/8dNWp1cSEa,Twitter for iPhone
1163,2016-04-21,722974582966214656,"<a href=""http://twitter.com/download/iphone"" rel=""nofollow"">Twitter for iPhone</a>",4493,1764,Happy 4/20 from the squad! 13/10 for all https://t.co/eV1diwds8a,Twitter for iPhone
1164,2016-04-20,722613351520608256,"<a href=""http://twitter.com/download/iphone"" rel=""nofollow"">Twitter for iPhone</a>",5393,1831,Meet Schnitzel. He's a Tropicana Floofboop. Getting too big for his favorite basket. 12/10 just so damn fluffy https://t.co/qjd0UJKYUY,Twitter for iPhone
1165,2016-04-17,721503162398597120,"<a href=""http://twitter.com/download/iphone"" rel=""nofollow"">Twitter for iPhone</a>",5086,2124,This is Panda. He's happy af. 11/10 https://t.co/IOAk9i4UvE,Twitter for iPhone
1166,2016-04-15,721001180231503872,"<a href=""http://twitter.com/download/iphone"" rel=""nofollow"">Twitter for iPhone</a>",2748,686,This is Oliver. Bath time is upon him. His fear of the wetness postpones his ultimate pupper destiny. 11/10 https://t.co/AFzzKqR4tT,Twitter for iPhone
1167,2016-04-15,720785406564900865,"<a href=""http://twitter.com/download/iphone"" rel=""nofollow"">Twitter for iPhone</a>",3400,866,This is Archie. He hears everything you say. Doesn't matter where you are. 12/10 https://t.co/0l4I8famYp,Twitter for iPhone
1168,2016-04-15,720775346191278080,"<a href=""http://twitter.com/download/iphone"" rel=""nofollow"">Twitter for iPhone</a>",2702,760,This is Berkeley. He's in a predicament. 10/10 someone help him https://t.co/XSEXdQupej,Twitter for iPhone
1169,2016-04-14,720415127506415616,"<a href=""http://twitter.com/download/iphone"" rel=""nofollow"">Twitter for iPhone</a>",4503,1681,Garden's coming in nice this year. 10/10 https://t.co/5Lra3e4rrw,Twitter for iPhone
1170,2016-04-13,720389942216527872,"<a href=""http://twitter.com/download/iphone"" rel=""nofollow"">Twitter for iPhone</a>",6974,2840,This is RalphÃ©. He patrols the lake. Looking for babes. 11/10 https://t.co/Pb6iMmo0wk,Twitter for iPhone
1171,2016-04-13,720340705894408192,"<a href=""http://twitter.com/download/iphone"" rel=""nofollow"">Twitter for iPhone</a>",3131,1098,This is Derek. He just got balled on. Can't even get up. Poor thing. 10/10 hang in there pupper https://t.co/BIRRF3bcWH,Twitter for iPhone
1172,2016-04-13,720059472081784833,"<a href=""http://twitter.com/download/iphone"" rel=""nofollow"">Twitter for iPhone</a>",4229,1268,This is Charleson. He lost his plunger. Looked everywhere. Can't find it. So sad. 9/10 would comfort https://t.co/pRHX8yn9Yu,Twitter for iPhone
1173,2016-04-13,720043174954147842,"<a href=""http://twitter.com/download/iphone"" rel=""nofollow"">Twitter for iPhone</a>",5332,2253,This is Neptune. He's a Snowy Swiss Mountain Floofapolis. Cheeky wink. Tongue nifty af. 11/10 would pet so firmly https://t.co/SoZq2Xoopv,Twitter for iPhone
1174,2016-04-12,719991154352222208,"<a href=""http://twitter.com/download/iphone"" rel=""nofollow"">Twitter for iPhone</a>",5281,1979,This doggo was initially thrilled when she saw the happy cartoon pup but quickly realized she'd been deceived. 10/10 https://t.co/mvnBGaWULV,Twitter for iPhone
1175,2016-04-12,719704490224398336,"<a href=""http://twitter.com/download/iphone"" rel=""nofollow"">Twitter for iPhone</a>",4974,1645,This is Clyde. He's making sure you're having a good train ride. 12/10 great pupper https://t.co/y206kWHAj0,Twitter for iPhone
1176,2016-04-11,719551379208073216,"<a href=""http://twitter.com/download/iphone"" rel=""nofollow"">Twitter for iPhone</a>",5515,2192,This is Harnold. He accidentally opened the front facing camera. 10/10 get it together Harnold https://t.co/S6JHaSMtln,Twitter for iPhone
1177,2016-04-11,719367763014393856,"<a href=""http://twitter.com/download/iphone"" rel=""nofollow"">Twitter for iPhone</a>",3022,827,Meet Sid &amp; Murphy. Murphy floats alongside Sid and whispers motivational quotes in his ear. Magical af. Both 11/10 https://t.co/7mmjyearQW,Twitter for iPhone
1178,2016-04-11,719339463458033665,"<a href=""http://twitter.com/download/iphone"" rel=""nofollow"">Twitter for iPhone</a>",4822,1403,Say hello to Lucy and Sophie. They think they're the same size. Both 10/10 would snug at same time https://t.co/HW50zkcf2R,Twitter for iPhone
1179,2016-04-11,719332531645071360,"<a href=""http://twitter.com/download/iphone"" rel=""nofollow"">Twitter for iPhone</a>",3711,1078,This is Pippa. She managed to start the car but is waiting for you to buckle up before driving. Responsible af 11/10 https://t.co/htrlmC7saz,Twitter for iPhone
1180,2016-04-10,718971898235854848,"<a href=""http://twitter.com/download/iphone"" rel=""nofollow"">Twitter for iPhone</a>",3818,1231,This is Sadie. She is prepared for battle. 10/10 https://t.co/JRckDkZVRT,Twitter for iPhone
1181,2016-04-09,718939241951195136,"<a href=""http://twitter.com/download/iphone"" rel=""nofollow"">Twitter for iPhone</a>",5720,1973,This is Otis. Everybody look at Otis. 12/10 would probably faint while petting https://t.co/I9qoe1uEih,Twitter for iPhone
1182,2016-04-09,718631497683582976,"<a href=""http://twitter.com/download/iphone"" rel=""nofollow"">Twitter for iPhone</a>",20697,9126,We normally don't rate marshmallows but this one appears to be flawlessly toasted so I'll make an exception. 10/10 https://t.co/D9jbbmPmos,Twitter for iPhone
1183,2016-04-09,718613305783398402,"<a href=""http://twitter.com/download/iphone"" rel=""nofollow"">Twitter for iPhone</a>",2669,542,This is Carper. He's a Tortellini Angiosperm. In desperate need of a petting. 11/10 would hug softly https://t.co/lK9YDkRzPj,Twitter for iPhone
1184,2016-04-08,718540630683709445,"<a href=""http://twitter.com/download/iphone"" rel=""nofollow"">Twitter for iPhone</a>",2730,1137,Get you a pup that can do both. 10/10 https://t.co/zSbyvm62xZ,Twitter for iPhone
1185,2016-04-08,718460005985447936,"<a href=""http://twitter.com/download/iphone"" rel=""nofollow"">Twitter for iPhone</a>",2846,602,Meet Bowie. He's listening for underground squirrels. Smart af. Left eye is considerably magical. 9/10 would so pet https://t.co/JyNmyjy3fe,Twitter for iPhone
1186,2016-04-08,718454725339934721,"<a href=""http://twitter.com/download/iphone"" rel=""nofollow"">Twitter for iPhone</a>",5320,1685,"This pic is old but I hadn't seen it until today and had to share. Creative af. 13/10 very good boy, would pet well https://t.co/4kD16wMA1Z",Twitter for iPhone
1187,2016-04-08,718246886998687744,"<a href=""http://twitter.com/download/iphone"" rel=""nofollow"">Twitter for iPhone</a>",2115,565,This is Alexanderson. He's got a weird ass birth mark. Dreadful at fetch. Won't eat kibble. 3/10 wtf @Target https://t.co/FmxOpf2Sgl,Twitter for iPhone
1188,2016-04-08,718234618122661888,"<a href=""http://twitter.com/download/iphone"" rel=""nofollow"">Twitter for iPhone</a>",4217,1127,This is Suki. She was born with a blurry tail (unfortunate). Next level tongue tho. 11/10 nifty hardwood https://t.co/05S8oYztgb,Twitter for iPhone
1189,2016-04-06,717841801130979328,"<a href=""http://twitter.com/download/iphone"" rel=""nofollow"">Twitter for iPhone</a>",2660,670,This is Barclay. His father was a banana. 11/10 appeeling af https://t.co/ucOEfr2rjV,Twitter for iPhone
1190,2016-04-06,717790033953034240,"<a href=""http://twitter.com/download/iphone"" rel=""nofollow"">Twitter for iPhone</a>",3170,1272,"Here's a badass mystery pupper. You weren't aware that you owe him money, but you do. 10/10 shades sick af https://t.co/fv9e9AtzSG",Twitter for iPhone
1191,2016-04-06,717537687239008257,"<a href=""http://twitter.com/download/iphone"" rel=""nofollow"">Twitter for iPhone</a>",6281,2069,People please. This is a Deadly Mediterranean Plop T-Rex. We only rate dogs. Only send in dogs. Thanks you... 11/10 https://t.co/2ATDsgHD4n,Twitter for iPhone
1192,2016-04-05,717428917016076293,"<a href=""http://vine.co"" rel=""nofollow"">Vine - Make a Scene</a>",1748,510,This is Skittle. He's trying to communicate. 11/10 solid effort https://t.co/6WTfJvtKx6,Vine - Make a Scene
1193,2016-04-05,717421804990701568,"<a href=""http://twitter.com/download/iphone"" rel=""nofollow"">Twitter for iPhone</a>",3446,945,This is Ebby. She's a Zimbabwean Feta. Embarrassed by ridiculously squishy face. 9/10 would squeeze softly https://t.co/LBJqxMGaHi,Twitter for iPhone
1194,2016-04-04,717047459982213120,"<a href=""http://twitter.com/download/iphone"" rel=""nofollow"">Twitter for iPhone</a>",6826,2135,This is FlÃ¡vio (pronounced Baxter). He's a Benesnoop Cumberdog. Super rare. Symmetrical. 12/10 would pet so well https://t.co/fGgleFiBPq,Twitter for iPhone
1195,2016-04-04,717009362452090881,"<a href=""http://twitter.com/download/iphone"" rel=""nofollow"">Twitter for iPhone</a>",3583,1102,This is Smokey. He's having some sort of existential crisis. 10/10 hang in there pupper https://t.co/JmgF4dMpw0,Twitter for iPhone
1196,2016-04-04,716802964044845056,"<a href=""http://twitter.com/download/iphone"" rel=""nofollow"">Twitter for iPhone</a>",4627,1317,This is Link. He struggles with couches. 10/10 would assist https://t.co/SbX4e6Yg3o,Twitter for iPhone
1197,2016-04-04,716791146589110272,"<a href=""http://twitter.com/download/iphone"" rel=""nofollow"">Twitter for iPhone</a>",5204,1474,Meet Jennifur. She's supposed to be navigating. Not even buckled up. Insubordinate &amp; churlish. 11/10 would still pet https://t.co/h0trcJohYO,Twitter for iPhone
1198,2016-04-03,716730379797970944,"<a href=""http://twitter.com/download/iphone"" rel=""nofollow"">Twitter for iPhone</a>",1339,475,"There has clearly been a mistake. Pup did nothing wrong. 12/10 would help escape
https://t.co/Juid3nnLbC",Twitter for iPhone
1199,2016-04-03,716447146686459905,"<a href=""http://vine.co"" rel=""nofollow"">Vine - Make a Scene</a>",14327,6643,This is Ozzy. He's acrobatic af. Legendary pupper status achieved. 13/10 https://t.co/gHWsCTu90E,Vine - Make a Scene
1200,2016-04-03,716439118184652801,"<a href=""http://twitter.com/download/iphone"" rel=""nofollow"">Twitter for iPhone</a>",2574,247,This is Bluebert. He just saw that both #FinalFur match ups are split 50/50. Amazed af. 11/10 https://t.co/Kky1DPG4iq,Twitter for iPhone
1201,2016-04-02,716285507865542656,"<a href=""http://twitter.com/download/iphone"" rel=""nofollow"">Twitter for iPhone</a>",3041,1225,This is Stephanus. She stays woke. 12/10 https://t.co/WIWabMngQZ,Twitter for iPhone
1202,2016-04-02,716080869887381504,"<a href=""http://twitter.com/download/iphone"" rel=""nofollow"">Twitter for iPhone</a>",5272,1935,Here's a super majestic doggo and a sunset 11/10 https://t.co/UACnoyi8zu,Twitter for iPhone
1203,2016-04-01,715928423106027520,"<a href=""http://twitter.com/download/iphone"" rel=""nofollow"">Twitter for iPhone</a>",3485,987,This is Bubbles. He's a Yorkshire Piccolope. 11/10 would snug aggressively https://t.co/3BhMojONxq,Twitter for iPhone
1204,2016-04-01,715758151270801409,"<a href=""http://vine.co"" rel=""nofollow"">Vine - Make a Scene</a>",4085,1596,This is old now but it's absolutely heckin fantastic and I can't not share it with you all. 13/10  https://t.co/wJX74TSgzP,Vine - Make a Scene
1205,2016-04-01,715733265223708672,"<a href=""http://twitter.com/download/iphone"" rel=""nofollow"">Twitter for iPhone</a>",5093,1920,This is a taco. We only rate dogs. Please only send in dogs. Dogs are what we rate. Not tacos. Thank you... 10/10 https://t.co/cxl6xGY8B9,Twitter for iPhone
1206,2016-04-01,715704790270025728,"<a href=""http://vine.co"" rel=""nofollow"">Vine - Make a Scene</a>",3055,634,This is Bentley. He gives kisses back. 11/10 precious af (vid by @emmaallen25) https://t.co/9PnKkKzoUp,Vine - Make a Scene
1207,2016-04-01,715696743237730304,"<a href=""http://twitter.com/download/iphone"" rel=""nofollow"">Twitter for iPhone</a>",4257,1454,Meet Toby. He's a Lithuanian High-Steppin Stickeroo. One of the more accomplished Stickeroos around. 10/10 so nifty https://t.co/cYPHuJYTjC,Twitter for iPhone
