,created_at,tweet_id,api_source,favorite_count,retweet_count,full_text,source_name
1687,2015-12-28,681340665377193984,"<a href=""http://twitter.com/download/iphone"" rel=""nofollow"">Twitter for iPhone</a>",1803,313,I've been told there's a slight possibility he's checking his mirror. We'll bump to 9.5/10. Still a menace,Twitter for iPhone
1688,2015-12-28,681339448655802368,"<a href=""http://twitter.com/download/iphone"" rel=""nofollow"">Twitter for iPhone</a>",10202,4598,This is Asher. He's not wearing a seatbelt or keeping both paws on the wheel. Absolute menace on the roadways. 9/10 https://t.co/V3SWuHACkh,Twitter for iPhone
1689,2015-12-28,681320187870711809,"<a href=""http://twitter.com/download/iphone"" rel=""nofollow"">Twitter for iPhone</a>",2918,863,This is Glacier. He's a very happy pup. Loves to sing in the sunlight. 11/10 https://t.co/jTBPqKgkz7,Twitter for iPhone
1690,2015-12-28,681302363064414209,"<a href=""http://twitter.com/download/iphone"" rel=""nofollow"">Twitter for iPhone</a>",4347,2072,This is Chuck. He's a neat dog. Very flexible. Trapped in a glass case of emotion. Devastatingly unfluffy 3/10 https://t.co/YqbU9xHV3p,Twitter for iPhone
1691,2015-12-28,681297372102656000,"<a href=""http://twitter.com/download/iphone"" rel=""nofollow"">Twitter for iPhone</a>",3490,1091,"This is actually a lion. We only rate dogs. For the last time please only send dogs. Thank u.
12/10 would still pet https://t.co/Pp26dMQxap",Twitter for iPhone
1692,2015-12-28,681281657291280384,"<a href=""http://twitter.com/download/iphone"" rel=""nofollow"">Twitter for iPhone</a>",3520,1258,Meet Sarge. His parents signed him up for dancing lessons but his true passion is roller coasters 11/10 very petable https://t.co/KvVoBIgkje,Twitter for iPhone
1693,2015-12-27,681261549936340994,"<a href=""http://twitter.com/download/iphone"" rel=""nofollow"">Twitter for iPhone</a>",1597,308,Say hello to Panda. He's a Quackadilly Shooster. Not amused by your fake ball throwing motion. 9/10 would hug lots https://t.co/wL1iDvbcVk,Twitter for iPhone
1694,2015-12-27,681242418453299201,"<a href=""http://twitter.com/download/iphone"" rel=""nofollow"">Twitter for iPhone</a>",1645,624,This is Champ. He's being sacrificed to the Aztec sun god Huitzilopochtli. So sad. 10/10 Champ doesn't deserve this https://t.co/VGsziXImoy,Twitter for iPhone
1695,2015-12-27,681231109724700672,"<a href=""http://twitter.com/download/iphone"" rel=""nofollow"">Twitter for iPhone</a>",2629,540,I just love this pic. 11/10 this pupper is going places https://t.co/P16uhh1PbI,Twitter for iPhone
1696,2015-12-27,681193455364796417,"<a href=""http://twitter.com/download/iphone"" rel=""nofollow"">Twitter for iPhone</a>",4077,1691,This is Aspen. He's astronomically fluffy. I wouldn't stop petting this dog if the world was ending around me 11/10 https://t.co/oBlgL9nxpx,Twitter for iPhone
1697,2015-12-27,680970795137544192,"<a href=""http://twitter.com/download/iphone"" rel=""nofollow"">Twitter for iPhone</a>",2665,749,I thought I made this very clear. We only rate dogs. Stop sending other things like this shark. Thank you... 9/10 https://t.co/CXSJZ4Stk3,Twitter for iPhone
1698,2015-12-27,680959110691590145,"<a href=""http://twitter.com/download/iphone"" rel=""nofollow"">Twitter for iPhone</a>",4986,2243,This is Ozzie. He was doing fine until he lost traction in those festive socks. Now he's tired. 9/10 still killin it https://t.co/u4FYdIRKnY,Twitter for iPhone
1699,2015-12-27,680940246314430465,"<a href=""http://twitter.com/download/iphone"" rel=""nofollow"">Twitter for iPhone</a>",3544,1225,This is Alice. She's an idiot. 4/10 https://t.co/VQXdwJfkyS,Twitter for iPhone
1700,2015-12-27,680934982542561280,"<a href=""http://twitter.com/download/iphone"" rel=""nofollow"">Twitter for iPhone</a>",2285,497,Say hello to Sadie. She's a Tortellini Sidewinder. Very jubilant pup. Seems loyal. Leaves on point. 10/10 petable af https://t.co/g2bTu4ayPl,Twitter for iPhone
1701,2015-12-27,680913438424612864,"<a href=""http://twitter.com/download/iphone"" rel=""nofollow"">Twitter for iPhone</a>",2609,705,Meet Griswold. He's dapper as hell. Already pumped for next Christmas. 11/10 https://t.co/5NrpNDyFzN,Twitter for iPhone
1702,2015-12-26,680889648562991104,"<a href=""http://twitter.com/download/iphone"" rel=""nofollow"">Twitter for iPhone</a>",1945,418,This is Cheesy. It's her birthday. She's patiently waiting to eat her party muffin. 9/10 happy birthday pup https://t.co/cH2H7mch2H,Twitter for iPhone
1703,2015-12-26,680836378243002368,"<a href=""http://twitter.com/download/iphone"" rel=""nofollow"">Twitter for iPhone</a>",3766,1513,This is Ellie. She's secretly ferocious. 12/10 very deadly pupper https://t.co/BF4BW8LUgb,Twitter for iPhone
1704,2015-12-26,680805554198020098,"<a href=""http://vine.co"" rel=""nofollow"">Vine - Make a Scene</a>",2370,751,This guy's dog broke. So sad. 9/10 would still pet https://t.co/BYiXJDEzv7,Vine - Make a Scene
1705,2015-12-26,680801747103793152,"<a href=""http://twitter.com/download/iphone"" rel=""nofollow"">Twitter for iPhone</a>",2600,925,Great picture here. Dog on the right panicked &amp; forgot about his tongue. Middle green dog must've fainted. All 10/10 https://t.co/31npKUAox0,Twitter for iPhone
1706,2015-12-26,680798457301471234,"<a href=""http://twitter.com/download/iphone"" rel=""nofollow"">Twitter for iPhone</a>",3134,1182,Say hello to Moofasa. He must be a powerful dog. Fenced in for your protection. Just got his ear pierced. 6/10 https://t.co/w6fRfQ3RXD,Twitter for iPhone
1707,2015-12-26,680609293079592961,"<a href=""http://twitter.com/download/iphone"" rel=""nofollow"">Twitter for iPhone</a>",2906,816,This is Brody. That is his chair. He loves his chair. Never leaves it. 9/10 might be stuck actually https://t.co/WvJRg0XJit,Twitter for iPhone
1708,2015-12-26,680583894916304897,"<a href=""http://twitter.com/download/iphone"" rel=""nofollow"">Twitter for iPhone</a>",3939,1514,This is Penny. Her tennis ball slowly rolled down her cone and into the pool. 8/10 bad things happen to good puppers https://t.co/YNWU7LeFgg,Twitter for iPhone
1709,2015-12-25,680497766108381184,"<a href=""http://twitter.com/download/iphone"" rel=""nofollow"">Twitter for iPhone</a>",4639,2162,Meet Percy. He's a Latvian Yuletide Heineken. Refuses to take off sweater. Kinda feisty. 12/10 would keep in pocket https://t.co/QGM5Fcuv7s,Twitter for iPhone
1710,2015-12-25,680494726643068929,"<a href=""http://twitter.com/download/iphone"" rel=""nofollow"">Twitter for iPhone</a>",1879,542,Here we have uncovered an entire battalion of holiday puppers. Average of 11.26/10 https://t.co/eNm2S6p9BD,Twitter for iPhone
1711,2015-12-25,680473011644985345,"<a href=""http://twitter.com/download/iphone"" rel=""nofollow"">Twitter for iPhone</a>",2778,844,"This is Hector. He thinks he's a hammer. Silly Hector. You're a pupper, not a hammer. 10/10 https://t.co/OdUFuZIXiI",Twitter for iPhone
1712,2015-12-25,680440374763077632,"<a href=""http://twitter.com/download/iphone"" rel=""nofollow"">Twitter for iPhone</a>",1583,564,Merry Christmas. My gift to you is this tiny unicorn running into a wall in slow motion. 11/10 https://t.co/UKqIAnR3He,Twitter for iPhone
1713,2015-12-25,680221482581123072,"<a href=""http://twitter.com/download/iphone"" rel=""nofollow"">Twitter for iPhone</a>",1598,329,This is CeCe. She's patiently waiting for Santa. 10/10 https://t.co/ZJUypFFwvg,Twitter for iPhone
1714,2015-12-25,680206703334408192,"<a href=""http://twitter.com/download/iphone"" rel=""nofollow"">Twitter for iPhone</a>",3115,1323,I hope everyone enjoys this picture as much as I do. This is Toby. 12/10 https://t.co/vHnu1g9EJm,Twitter for iPhone
1715,2015-12-25,680191257256136705,"<a href=""http://twitter.com/download/iphone"" rel=""nofollow"">Twitter for iPhone</a>",2356,577,Here's a sleepy Christmas pupper 11/10 https://t.co/KXg0f8GNQ9,Twitter for iPhone
1716,2015-12-25,680176173301628928,"<a href=""http://twitter.com/download/iphone"" rel=""nofollow"">Twitter for iPhone</a>",4263,1760,This pupper is patiently waiting to scare the shit out of Santa. 10/10 https://t.co/NhXo67K6yt,Twitter for iPhone
1717,2015-12-24,680161097740095489,"<a href=""http://twitter.com/download/iphone"" rel=""nofollow"">Twitter for iPhone</a>",2538,828,Meet Goliath. He's an example of irony. Head is phenomenally round. Wants to be an ornament. 12/10 would hug gently https://t.co/72Dil0Aktw,Twitter for iPhone
1718,2015-12-24,680145970311643136,"<a href=""http://twitter.com/download/iphone"" rel=""nofollow"">Twitter for iPhone</a>",3955,1972,Say hello to Kawhi. He was doing fine until his hat fell off. He got it back though. 10/10 deep breaths pupper https://t.co/N5pM6WBx7e,Twitter for iPhone
1719,2015-12-24,680130881361686529,"<a href=""http://twitter.com/download/iphone"" rel=""nofollow"">Twitter for iPhone</a>",2519,1078,This is Reggie. His Santa hat is a little big. 10/10 he's still having fun https://t.co/w0dcGXq7qK,Twitter for iPhone
1720,2015-12-24,680115823365742593,"<a href=""http://twitter.com/download/iphone"" rel=""nofollow"">Twitter for iPhone</a>",2972,1028,This is Ozzy. He woke up 2 minutes before he had to be ready for the Christmas party. 9/10 classic Ozzy https://t.co/Kt9vmw0Fap,Twitter for iPhone
1721,2015-12-24,680100725817409536,"<a href=""https://about.twitter.com/products/tweetdeck"" rel=""nofollow"">TweetDeck</a>",3891,1554,This pupper is not coming inside until she catches a snowflake on her tongue. 11/10 the determination is palpable https://t.co/lvMYbmKq8H,TweetDeck
1722,2015-12-24,680085611152338944,"<a href=""https://about.twitter.com/products/tweetdeck"" rel=""nofollow"">TweetDeck</a>",13959,10034,This is by far the most coordinated series of pictures I was sent. Downright impressive in every way. 12/10 for all https://t.co/etzLo3sdZE,TweetDeck
1723,2015-12-24,680070545539371008,"<a href=""https://about.twitter.com/products/tweetdeck"" rel=""nofollow"">TweetDeck</a>",2818,994,Say hello to Emmie. She's trapped in an ornament. Tragic af. Looks pretty content tho. Maybe it's meant to be. 9/10 https://t.co/Fh7geodBCU,TweetDeck
1724,2015-12-24,680055455951884288,"<a href=""https://about.twitter.com/products/tweetdeck"" rel=""nofollow"">TweetDeck</a>",18278,8067,"Meet Sammy. At first I was like ""that's a snowflake. we only rate dogs,"" but he would've melted by now, so 10/10 https://t.co/MQfPK4zwuh",TweetDeck
1725,2015-12-24,679877062409191424,"<a href=""http://twitter.com/download/iphone"" rel=""nofollow"">Twitter for iPhone</a>",2155,726,Meet Penelope. She's a bacon frise. Total babe (lol get it like the movie). Doesn't bark tho. 5/10 very average dog https://t.co/SDcQYg0HSZ,Twitter for iPhone
1726,2015-12-24,679872969355714560,"<a href=""http://vine.co"" rel=""nofollow"">Vine - Make a Scene</a>",2365,749,This is Rocco. He's in a very intense game of freeze tag. Currently waiting to be unfrozen 10/10 https://t.co/xZXUKVXJ7l,Vine - Make a Scene
1727,2015-12-24,679862121895714818,"<a href=""http://twitter.com/download/iphone"" rel=""nofollow"">Twitter for iPhone</a>",2678,706,"""Dammit hooman I'm jus trynna lik the fler"" 11/10 https://t.co/eRZRI8OTj7",Twitter for iPhone
1728,2015-12-24,679854723806179328,"<a href=""http://twitter.com/download/iphone"" rel=""nofollow"">Twitter for iPhone</a>",3143,1402,This is Bruce. He's a rare pup. Covered in Frosted Flakes. Nifty gold teeth. Overall good dog. 7/10 would pet firmly https://t.co/RtxxACzZ8A,Twitter for iPhone
1729,2015-12-24,679844490799091713,"<a href=""http://twitter.com/download/iphone"" rel=""nofollow"">Twitter for iPhone</a>",2593,887,This is Willie. He's floating away and needs your assistance. Please someone help Willie. 10/10 https://t.co/MJqygWqt8X,Twitter for iPhone
1730,2015-12-24,679828447187857408,"<a href=""http://twitter.com/download/iphone"" rel=""nofollow"">Twitter for iPhone</a>",39726,15839,Everybody look at this beautiful pupper 13/10 https://t.co/hyAC5Hq9GC,Twitter for iPhone
1731,2015-12-23,679777920601223168,"<a href=""http://twitter.com/download/iphone"" rel=""nofollow"">Twitter for iPhone</a>",3390,1281,This is Rinna. She's melting. 10/10 get inside pupper https://t.co/PA0czwucsb,Twitter for iPhone
1732,2015-12-23,679736210798047232,"<a href=""http://twitter.com/download/iphone"" rel=""nofollow"">Twitter for iPhone</a>",2311,918,This pup's name is Sabertooth (parents must be cool). Ears for days. Jumps unannounced. 9/10 would pet diligently https://t.co/iazoiNUviP,Twitter for iPhone
1733,2015-12-23,679729593985699840,"<a href=""http://twitter.com/download/iphone"" rel=""nofollow"">Twitter for iPhone</a>",2367,937,This is Hunter. He was playing with his ball minding his own business. Has no idea what happened to the carpet. 8/10 https://t.co/DbUTDI3u1R,Twitter for iPhone
1734,2015-12-23,679722016581222400,"<a href=""http://twitter.com/download/iphone"" rel=""nofollow"">Twitter for iPhone</a>",1817,539,This is Mike. He is a Jordanian Frito Pilates. Frowning because he can't see directly in front of him. 8/10 https://t.co/NL5QJwdEpF,Twitter for iPhone
1735,2015-12-23,679530280114372609,"<a href=""http://twitter.com/download/iphone"" rel=""nofollow"">Twitter for iPhone</a>",5208,2347,Guys this really needs to stop. We've been over this way too many times. This is a giraffe. We only rate dogs.. 7/10 https://t.co/yavgkHYPOC,Twitter for iPhone
1736,2015-12-23,679527802031484928,"<a href=""http://twitter.com/download/iphone"" rel=""nofollow"">Twitter for iPhone</a>",2892,823,This little pupper just arrived. 11/10 would snug https://t.co/DA5aqnSGfB,Twitter for iPhone
1737,2015-12-23,679511351870550016,"<a href=""http://twitter.com/download/iphone"" rel=""nofollow"">Twitter for iPhone</a>",3711,1461,Say hello to William. He makes fun of others because he's terrified of his own deep-seated insecurities. 7/10 https://t.co/bwuV6FlRxr,Twitter for iPhone
1738,2015-12-23,679503373272485890,"<a href=""http://twitter.com/download/iphone"" rel=""nofollow"">Twitter for iPhone</a>",3484,1673,This is Dwight. He's a pointy pupper. Very docile. Attracts marshmallows. Hurts to pet but definitely worth it 8/10 https://t.co/jjW7zTxY9Z,Twitter for iPhone
1739,2015-12-23,679475951516934144,"<a href=""http://twitter.com/download/iphone"" rel=""nofollow"">Twitter for iPhone</a>",2304,728,This is Evy. She doesn't want to be a Koala. 9/10 https://t.co/VITeF0Kl9L,Twitter for iPhone
1740,2015-12-23,679462823135686656,"<a href=""http://twitter.com/download/iphone"" rel=""nofollow"">Twitter for iPhone</a>",34856,21324,Meet Hurley. He's the curly one. He hugs every other dog he sees during his walk. 11/10 for spreading the love https://t.co/M6vqkt2GKV,Twitter for iPhone
1741,2015-12-22,679405845277462528,"<a href=""http://vine.co"" rel=""nofollow"">Vine - Make a Scene</a>",2594,1364,Crazy unseen footage from Jurassic Park. 10/10 for both dinosaur puppers https://t.co/L8wt2IpwxO,Vine - Make a Scene
1742,2015-12-22,679158373988876288,"<a href=""http://twitter.com/download/iphone"" rel=""nofollow"">Twitter for iPhone</a>",23568,9193,This is Rubio. He has too much skin. 11/10 https://t.co/NLOHmlENag,Twitter for iPhone
1743,2015-12-22,679148763231985668,"<a href=""http://twitter.com/download/iphone"" rel=""nofollow"">Twitter for iPhone</a>",3028,1163,I know everyone's excited for Christmas but that doesn't mean you can send in reindeer. We only rate dogs... 8/10 https://t.co/eWjWgbOCYL,Twitter for iPhone
1744,2015-12-22,679132435750195208,"<a href=""http://twitter.com/download/iphone"" rel=""nofollow"">Twitter for iPhone</a>",3253,1314,This is Louis. He's a river dancer. His friends think it's badass. All are very supportive. 10/10 for Louis https://t.co/qoIvjKMY58,Twitter for iPhone
1745,2015-12-22,679111216690831360,"<a href=""http://twitter.com/download/iphone"" rel=""nofollow"">Twitter for iPhone</a>",6514,2893,This is officially the greatest yawn of all time. 12/10 https://t.co/4R0Cc0sLVE,Twitter for iPhone
1746,2015-12-21,679062614270468097,"<a href=""http://twitter.com/download/iphone"" rel=""nofollow"">Twitter for iPhone</a>",18712,9299,This is Chompsky. He lives up to his name. 11/10 https://t.co/Xl37lQEWd0,Twitter for iPhone
1747,2015-12-21,679047485189439488,"<a href=""http://twitter.com/download/iphone"" rel=""nofollow"">Twitter for iPhone</a>",2460,781,This dog doesn't know how to stairs. Quite tragic really. 9/10 get it together pup https://t.co/kTpr9PTMg1,Twitter for iPhone
1748,2015-12-21,679001094530465792,"<a href=""http://vine.co"" rel=""nofollow"">Vine - Make a Scene</a>",3075,1378,This is Rascal. He's paddling an imaginary canoe. 11/10 https://t.co/Ajquq6oGSg,Vine - Make a Scene
1749,2015-12-21,678991772295516161,"<a href=""http://twitter.com/download/iphone"" rel=""nofollow"">Twitter for iPhone</a>",2537,1333,If your Monday isn't going so well just take a look at this. Both 12/10 https://t.co/GJT6SILPGU,Twitter for iPhone
1750,2015-12-21,678969228704284672,"<a href=""http://twitter.com/download/iphone"" rel=""nofollow"">Twitter for iPhone</a>",1796,528,Meet Lola. She's a Metamorphic Chartreuse. Plays with her food. Insubordinate and churlish. Exquisite hardwood 11/10 https://t.co/etpBNXwN7f,Twitter for iPhone
1751,2015-12-21,678800283649069056,"<a href=""http://twitter.com/download/iphone"" rel=""nofollow"">Twitter for iPhone</a>",2810,1018,Here's a pupper with some mean tan lines. Snazzy sweater though 12/10 https://t.co/DpCSVsl6vu,Twitter for iPhone
1752,2015-12-21,678798276842360832,"<a href=""http://twitter.com/download/iphone"" rel=""nofollow"">Twitter for iPhone</a>",3804,1350,This is Linda. She fucking hates trees. 7/10 https://t.co/blaY85FIxR,Twitter for iPhone
1753,2015-12-21,678774928607469569,"<a href=""http://twitter.com/download/iphone"" rel=""nofollow"">Twitter for iPhone</a>",3037,1043,This is Tug. He's not required to wear the cone he just wants his voice to project more clearly. 11/10 https://t.co/Sp739Ou2qx,Twitter for iPhone
1754,2015-12-21,678767140346941444,"<a href=""http://twitter.com/download/iphone"" rel=""nofollow"">Twitter for iPhone</a>",3864,1553,This is Mia. She makes awful decisions. 8/10 https://t.co/G6TQVgTcZz,Twitter for iPhone
1755,2015-12-21,678764513869611008,"<a href=""http://twitter.com/download/iphone"" rel=""nofollow"">Twitter for iPhone</a>",1788,544,"Meet Wilson. He got caught humping the futon. He's like ""dude, help me out here"" 10/10 I'd help Wilson out https://t.co/m6XoclB0qv",Twitter for iPhone
1756,2015-12-21,678755239630127104,"<a href=""http://twitter.com/download/iphone"" rel=""nofollow"">Twitter for iPhone</a>",7802,3741,This is Dash. He didn't think the water would be that cold. Damn it Dash it's December. Think a little. 10/10 https://t.co/NqcOwG8pxW,Twitter for iPhone
1757,2015-12-21,678740035362037760,"<a href=""http://twitter.com/download/iphone"" rel=""nofollow"">Twitter for iPhone</a>",4099,1926,Meet Tango. He's a large dog. Doesn't care much for personal space. Owner isn't very accepting. Tongue slip. 6/10 https://t.co/p2T5kGebxe,Twitter for iPhone
1758,2015-12-20,678708137298427904,"<a href=""http://vine.co"" rel=""nofollow"">Vine - Make a Scene</a>",6082,2753,Here we are witnessing a wild field pupper. Lost his wallet in there. Rather unfortunate. 10/10 good luck pup https://t.co/sZy9Co74Bw,Vine - Make a Scene
1759,2015-12-20,678675843183484930,"<a href=""http://twitter.com/download/iphone"" rel=""nofollow"">Twitter for iPhone</a>",3155,1680,Exotic pup here. Tail long af. Throat looks swollen. Might breathe fire. Exceptionally unfluffy 2/10 would still pet https://t.co/a8SqCaSo2r,Twitter for iPhone
1760,2015-12-20,678643457146150913,"<a href=""http://twitter.com/download/iphone"" rel=""nofollow"">Twitter for iPhone</a>",2250,489,Meet Grizz. He just arrived. Couldn't wait until Christmas. Worried bc he saw the swastikas on the carpet. 10/10 https://t.co/QBGwYrT7rv,Twitter for iPhone
1761,2015-12-20,678446151570427904,"<a href=""http://twitter.com/download/iphone"" rel=""nofollow"">Twitter for iPhone</a>",4358,1785,Touching scene here. Really stirs up the emotions. The bond between father &amp; son. So beautiful. 10/10 for both pups https://t.co/AJWJHov5gx,Twitter for iPhone
1762,2015-12-20,678424312106393600,"<a href=""http://twitter.com/download/iphone"" rel=""nofollow"">Twitter for iPhone</a>",5916,2880,This is Crystal. She's a shitty fireman. No sense of urgency. People could be dying Crystal. 2/10 just irresponsible https://t.co/rtMtjSl9pz,Twitter for iPhone
1763,2015-12-20,678410210315247616,"<a href=""http://twitter.com/download/iphone"" rel=""nofollow"">Twitter for iPhone</a>",4640,2072,Say hello to Jerome. He can shoot french fries out of his mouth at insane speeds. Deadly af. 10/10 https://t.co/dIy88HwrX8,Twitter for iPhone
1764,2015-12-20,678399652199309312,"<a href=""http://twitter.com/download/iphone"" rel=""nofollow"">Twitter for iPhone</a>",61794,30742,This made my day. 12/10 please enjoy https://t.co/VRTbo3aAcm,Twitter for iPhone
1765,2015-12-20,678396796259975168,"<a href=""http://twitter.com/download/iphone"" rel=""nofollow"">Twitter for iPhone</a>",1731,478,These little fellas have opposite facial expressions. Both 12/10 https://t.co/LmThv0GWen,Twitter for iPhone
1766,2015-12-20,678389028614488064,"<a href=""http://twitter.com/download/iphone"" rel=""nofollow"">Twitter for iPhone</a>",2044,473,"This is Bella. She just learned that her final grade in chem was a 92.49 
poor pupper 11/10 https://t.co/auOoKuoveM",Twitter for iPhone
1767,2015-12-20,678380236862578688,"<a href=""http://twitter.com/download/iphone"" rel=""nofollow"">Twitter for iPhone</a>",2655,1020,This is Crumpet. He underestimated the snow. Quickly retreating. 10/10 https://t.co/a0Zx5LDFZa,Twitter for iPhone
1768,2015-12-19,678341075375947776,"<a href=""http://twitter.com/download/iphone"" rel=""nofollow"">Twitter for iPhone</a>",1896,612,This pupper likes tape. 12/10 https://t.co/cSp6w5GWgm,Twitter for iPhone
1769,2015-12-19,678334497360859136,"<a href=""http://twitter.com/download/iphone"" rel=""nofollow"">Twitter for iPhone</a>",1427,304,This is Rosie. She has a snazzy bow tie and a fin for a tail. Probably super fast underwater. Cool socks 10/10 https://t.co/GO76MdGBs0,Twitter for iPhone
1770,2015-12-19,678278586130948096,"<a href=""http://twitter.com/download/iphone"" rel=""nofollow"">Twitter for iPhone</a>",12531,6857,Another spooky pupper here. Most definitely floating. No legs. Probably knows some dark magic. 10/10 very spooked https://t.co/JK8MByRzgj,Twitter for iPhone
1771,2015-12-19,678255464182861824,"<a href=""http://twitter.com/download/iphone"" rel=""nofollow"">Twitter for iPhone</a>",1726,418,This is Jessifer. She is a Bismoth Teriyaki. Flowers being attacked by hurricanes on bandana (rad). 9/10 stellar pup https://t.co/nZhmRwZzWv,Twitter for iPhone
1772,2015-12-19,678023323247357953,"<a href=""http://twitter.com/download/iphone"" rel=""nofollow"">Twitter for iPhone</a>",2095,439,After getting lost in Reese's eyes for several minutes we're going to upgrade him to a 13/10,Twitter for iPhone
1773,2015-12-19,678021115718029313,"<a href=""http://twitter.com/download/iphone"" rel=""nofollow"">Twitter for iPhone</a>",15018,7148,This is Reese. He likes holding hands. 12/10 https://t.co/cbLroGCbmh,Twitter for iPhone
1774,2015-12-18,677961670166224897,"<a href=""http://vine.co"" rel=""nofollow"">Vine - Make a Scene</a>",3701,1879,This is Izzy. She's showing off the dance moves she's been working on. 11/10 I guess hard work pays off https://t.co/4JS92YAxTi,Vine - Make a Scene
1775,2015-12-18,677918531514703872,"<a href=""http://twitter.com/download/iphone"" rel=""nofollow"">Twitter for iPhone</a>",1476,463,"""Everything looks pretty good in there. Make sure to brush your gums. Been flossing? How's school going?"" Both 10/10 https://t.co/lWL2IMJqLR",Twitter for iPhone
1776,2015-12-18,677895101218201600,"<a href=""http://twitter.com/download/iphone"" rel=""nofollow"">Twitter for iPhone</a>",5275,2384,Guys this was terrifying. Really spooked me up. We don't rate ghosts. We rate dogs. Please only send dogs... 9/10 https://t.co/EJImi1udYb,Twitter for iPhone
1777,2015-12-18,677716515794329600,"<a href=""http://twitter.com/download/iphone"" rel=""nofollow"">Twitter for iPhone</a>",3323,1104,IT'S PUPPERGEDDON. Total of 144/120 ...I think https://t.co/ZanVtAtvIq,Twitter for iPhone
1778,2015-12-18,677700003327029250,"<a href=""http://twitter.com/download/iphone"" rel=""nofollow"">Twitter for iPhone</a>",3689,1622,This is Ralph. He's an interpretive dancer. 10/10 https://t.co/zoDdPyPFsa,Twitter for iPhone
1779,2015-12-18,677698403548192770,"<a href=""http://twitter.com/download/iphone"" rel=""nofollow"">Twitter for iPhone</a>",1332,363,This is Sadie. She got her holidays confused. 9/10 damn it Sadie https://t.co/fm7HxOsuPK,Twitter for iPhone
1780,2015-12-18,677687604918272002,"<a href=""http://twitter.com/download/iphone"" rel=""nofollow"">Twitter for iPhone</a>",2681,950,This was Cindy's face when she heard Susan forgot the snacks for after the kid's soccer game. 11/10 https://t.co/gzkuVGRgAD,Twitter for iPhone
1781,2015-12-18,677673981332312066,"<a href=""http://twitter.com/download/iphone"" rel=""nofollow"">Twitter for iPhone</a>",3603,1677,Endangered triangular pup here. Could be a wizard. Caught mid-laugh. No legs. Just fluff. Probably a wizard. 9/10 https://t.co/GFVIHIod0Z,Twitter for iPhone
1782,2015-12-18,677662372920729601,"<a href=""http://twitter.com/download/iphone"" rel=""nofollow"">Twitter for iPhone</a>",2134,1101,"In honor of the new Star Wars movie. Here's Yoda pug. 12/10 pet really well, would I https://t.co/pvjdRn00XH",Twitter for iPhone
1783,2015-12-18,677644091929329666,"<a href=""http://twitter.com/download/iphone"" rel=""nofollow"">Twitter for iPhone</a>",2040,886,This is a dog swinging. I really enjoyed it so I hope you all do as well. 11/10 https://t.co/Ozo9KHTRND,Twitter for iPhone
